word,meaning,sentence,sentence_translation
abroad,해외로,"He is currently living and working abroad.","그는 현재 해외에서 거주하며 일하고 있다."
abrupt,"갑작스러운; 뜻밖의","The car came to an abrupt halt.","차가 갑작스럽게 멈춰 섰다."
academic,"학업의; 학문적인; 학구적인","She has an excellent academic record.","그녀는 학업 성적이 매우 우수하다."
acceptable,"받아들일 수 있는; 인정할 만한","His performance was acceptable, but not outstanding.","그의 실적은 괜찮았지만 뛰어나지는 않았다."
accommodate,"수용하다; 맞추다","The hotel can accommodate up to 500 guests.","그 호텔은 최대 500명의 손님을 수용할 수 있다."
accountable,"책임 있는; 설명할 수 있는","You will be held accountable for your actions.","당신은 자신의 행동에 대해 책임을 져야 할 것입니다."
achieve,"성취하다; 달성하다","She worked hard to achieve her dream.","그녀는 꿈을 이루기 위해 열심히 노력했다."
acidic,"산성의; 신","Lemons have a very acidic taste.","레몬은 매우 신 맛이 난다."
acknowledgement,"승인; 인정","We are still waiting for an official acknowledgement from the company.","우리는 여전히 그 회사로부터 공식적인 인정을 기다리고 있다."
acoustic,"청각의; 음향의; 어쿠스틱(전기 앰프를 사용하지 않는 악기)","He played an acoustic guitar.","그는 어쿠스틱 기타를 연주했다."
across,"가로질러; 맞은편에;~을 가로지르는","The library is just across the street.","도서관은 바로 길 건너편에 있다."
adaptable,"적응할 수 있는","He is an adaptable employee who learns new skills quickly.","그는 새로운 기술을 빨리 배우는 적응력 있는 직원이다."
add,"합치다; 추가하다","Please add my name to the list.","제 이름을 명단에 추가해 주세요."
addictive,"중독성의; 습관성의","Many people find video games to be highly addictive.","많은 사람들이 비디오 게임이 중독성이 매우 강하다고 생각한다."
address,"연설; 주소;연설하다; 주소를 쓰다; 처리하다","The president will address the nation tonight.;We need to address this problem immediately.","대통령은 오늘 밤 대국민 연설을 할 것입니다.;우리는 이 문제를 즉시 처리해야 한다."
adjustable,"조정 가능한","This office chair has an adjustable height.","이 사무용 의자는 높이 조절이 가능하다."
administer,"관리하다; 집행하다","It is her job to administer the company's finances.","회사의 재정을 관리하는 것이 그녀의 일이다."
administration,"관리; 행정; 경영진","The school administration has decided to change the policy.","학교 행정부는 그 방침을 바꾸기로 결정했다."
admire,"존경하다; 감탄하다","I really admire her for her dedication.","나는 그녀의 헌신에 진심으로 감탄한다."
adopt,"채택하다; 입양하다","The committee decided to adopt a new strategy.;They are planning to adopt a baby.","위원회는 새로운 전략을 채택하기로 결정했다.;그들은 아기를 입양할 계획이다."
advantage,"유리; 이점; 장점","Being tall is a big advantage in basketball.","키가 큰 것은 농구에서 큰 이점이다."
adventurous,"모험심이 강한","He leads a very adventurous life.","그는 매우 모험적인 삶을 산다."
adverse,"반대의; 부정적인","The drug has no adverse side effects.","그 약은 부작용이 없다."
advise,"의논하다; 충고하다; 알리다","I would advise you to book your tickets in advance.","표를 미리 예매하라고 조언하고 싶습니다."
affect,"영향을 미치다; 충격을 주다","The weather can greatly affect people's moods.","날씨는 사람들의 기분에 큰 영향을 미칠 수 있다."
affectionate,"애정 깊은; 상냥한","He is very affectionate towards his family.","그는 가족에게 매우 다정하다."
affirmative,"긍정의 말;긍정하는","She gave an affirmative nod.","그녀는 긍정의 뜻으로 고개를 끄덕였다."
affordable,"감당할 수 있는; 알맞은","This restaurant offers delicious and affordable meals.","이 식당은 맛있고 저렴한 식사를 제공한다."
aftermath,"여파; 영향","In the aftermath of the storm, many roads were blocked.","폭풍의 여파로 많은 도로가 막혔다."
afterward,"후에; 나중에","We had dinner and went for a walk afterward.","우리는 저녁을 먹고 그 후에 산책을 갔다."
agreeable,"기분 좋은; 받아들일 수 있는; 알맞은","We spent an agreeable afternoon in the park.","우리는 공원에서 기분 좋은 오후를 보냈다."
aimless,"목적 없는; 방향을 잃은","He wandered through the city with no aimless direction.","그는 목적 없이 도시를 헤맸다."
alcoholic,"알코올 중독자;술의; 알코올성의","He is a recovering alcoholic attending support meetings.","그는 지원 모임에 참석하는 회복 중인 알코올 중독자이다."
alignment,가지런함,"The alignment of the books on the shelf was perfect.","선반 위 책들의 정렬은 완벽했다."
allegedly,"주장하는 바에 따르면; 전해진 바에 의하면","She allegedly stole the necklace from the store.","전해진 바에 따르면 그녀는 그 가게에서 목걸이를 훔쳤다고 한다."
allocation,"할당; 배당액","The allocation of funds for the new project was approved.","새 프로젝트를 위한 자금 할당이 승인되었다."
allow,"허락하다; 할 수 있게 해주다","My parents won't allow me to stay out late.","부모님은 내가 늦게까지 밖에 있는 것을 허락하지 않으신다."
allowance,"수당; 용돈; 공제; 허용","I receive a small monthly allowance from my parents.","나는 부모님으로부터 매달 적은 용돈을 받는다."
along with,"~과 함께","She brought a friend along with her to the party.","그녀는 파티에 친구를 데리고 왔다."
alter,"변하다; 바꾸다","We may have to alter our plans because of the weather.","날씨 때문에 우리는 계획을 변경해야 할지도 모른다."
alternatively,"대신에; 양자택일로","We could go to the cinema, or alternatively, we could stay home and watch a movie.","우리는 영화관에 가거나, 아니면 집에서 영화를 볼 수도 있다."
altruism,"이타주의; 이타심","Firefighters often show great altruism in their work.","소방관들은 종종 자신의 일에서 위대한 이타심을 보여준다."
amateur,"아마추어; 비전문가;취미로 하는; 아마추어의","He's an amateur photographer, but his pictures are amazing.","그는 아마추어 사진작가이지만, 그의 사진들은 정말 훌륭하다."
amazing,"놀라운; 멋진; 기가 막힌","The view from the top of the mountain was absolutely amazing.","산 정상에서 바라본 경치는 정말 놀라웠다."
ambiguous,"애매모호한","The instructions were ambiguous, so I didn't know what to do.","지시사항이 애매모호해서, 나는 무엇을 해야 할지 몰랐다."
amend,"고치다; 개정하다","The government decided to amend the law.","정부는 그 법률을 개정하기로 결정했다."
amplifier,"확대하는 사람(것); 앰프; 증폭기","The guitarist plugged his guitar into a large amplifier.","그 기타리스트는 자신의 기타를 큰 앰프에 꽂았다."
amusement,"재미; 오락","His eyes were filled with amusement.","그의 눈은 재미있다는 듯이 빛나고 있었다."
ancient,"고대인;고대의; 오래된","We visited the ancient city of Athens.","우리는 고대 도시 아테네를 방문했다."
angular,"모난; 각도의; 뼈가 앙상한","He had a thin, angular face.","그는 마르고 각진 얼굴을 가지고 있었다."
animated,"활기찬; 만화 영화로 된","She became very animated when she started talking about her trip.","그녀는 자신의 여행에 대해 이야기하기 시작했을 때 매우 활기차졌다."
anniversary,기념일,"We are celebrating our tenth wedding anniversary today.","우리는 오늘 결혼 10주년 기념일을 축하하고 있다."
annual,"연보; 졸업 앨범;1년에 걸치는; 해마다의","The company has its annual meeting in December.","그 회사는 12월에 연례 회의를 한다."
antique,"골동품;골동품인","The shop sells antique furniture and jewelry.","그 가게는 골동 가구와 보석을 판매한다."
anxiously,"걱정스럽게; 애타게","She anxiously waited for the doctor's call.","그녀는 걱정스럽게 의사의 전화를 기다렸다."
apparently,"겉으로 보기에; 분명히","Apparently, he is going to resign from his position.","겉으로 보기에, 그는 자리에서 물러날 것 같다."
appeal,"간청; 호소; 매력;호소하다; 인기가 있다","The charity made an appeal for donations.;This type of music appeals to a younger audience.","그 자선단체는 기부를 호소했다.;이런 종류의 음악은 젊은 층에게 인기가 있다."
appear,"나타나다; ~인 것 같이 보이다","He appeared to be tired after the long journey.","그는 긴 여행 후에 피곤해 보였다."
"apply for","~에 지원하다","I am going to apply for the marketing position.","저는 마케팅 직무에 지원할 것입니다."
appreciate,"진가를 알아보다; 고마워하다; (제대로) 인식하다","I really appreciate all your hard work.","당신의 모든 노고에 진심으로 감사합니다."
approachable,"접근 가능한; 말을 붙이기 쉬운","The manager is very approachable and easy to talk to.","그 관리자는 매우 다가가기 쉽고 이야기하기 편하다."
area,"지역; 구역; 면적","Many people are moving out of rural areas to the city.","많은 사람들이 농촌 지역을 떠나 도시로 이주하고 있다."
argue,"주장을 하다; 언쟁을 하다; 분명히 보여주다","I don't want to argue with you about this.","나는 이 문제로 당신과 언쟁하고 싶지 않아요."
arise,"발생하다; 생기다; 일어나다","Problems may arise if we don't plan carefully.","우리가 신중하게 계획하지 않으면 문제가 발생할 수 있다."
armed,무장한,"The bank robbers were armed and dangerous.","은행 강도들은 무장했고 위험했다."
article,"기사; 논문; 물품; 관사; 열거하다","I read an interesting article about climate change.","나는 기후 변화에 대한 흥미로운 기사를 읽었다."
as such,"따라서; 그렇게","He is a member of the club and, as such, has the right to use the facilities.","그는 클럽의 회원이며, 따라서 시설을 이용할 권리가 있다."
as well,"~도 또한; 역시","If you are going to the party, I'll come as well.","네가 파티에 간다면, 나도 역시 갈 것이다."
assault,"공격; 폭행; 공격하다; 폭행하다","The man was charged with assault after the fight.","그 남자는 싸움 후에 폭행 혐의로 기소되었다."
assertive,"적극적인; 확신에 찬","You need to be more assertive in meetings to make your point.","자신의 의견을 말하려면 회의에서 더 적극적일 필요가 있다."
assignment,"과제; 임무; 배정","My history assignment is due on Friday.","내 역사 과제는 금요일까지이다."
assistant,"조수; 보조원; 부-; 조-","She works as a research assistant at the university.","그녀는 대학에서 연구 조교로 일한다."
assorted,"여러 가지의; 갖가지","The box contained an assorted collection of candies.","그 상자에는 여러 종류의 사탕이 들어 있었다."
at any rate,"어쨌든; 적어도; 하여튼","I'm not sure if he will come, but at any rate, we should be prepared.","그가 올지 확실하지 않지만, 어쨌든 우리는 준비해야 한다."
attach,"붙이다; 달라붙다","Please attach a recent photograph to your application form.","지원서에 최근 사진을 첨부해 주세요."
attend,"출석하다; 다니다; 돌보다","How many people will attend the conference?","얼마나 많은 사람들이 그 회의에 참석할까요?"
attendance,"출석; 참석자 수; 입장객 수","Attendance has been low at recent school events.","최근 학교 행사의 참석률이 저조했다."
attitude,"태도; 사고방식; 자세","His positive attitude makes him a great team member.","그의 긍정적인 태도는 그를 훌륭한 팀원으로 만든다."
attorney,"변호사; 대리인","You should seek advice from an attorney.","변호사에게 조언을 구해야 합니다."
attractiveness,매력,"The main attractiveness of the town is its historical architecture.","그 마을의 주된 매력은 역사적인 건축물이다."
audience,"청중; 관객; 지지자","The audience applauded loudly after the performance.","공연이 끝난 후 관객들은 큰 박수를 보냈다."
august,"위엄 있는; 존엄한","We visited the august halls of the national museum.","우리는 국립 박물관의 위엄 있는 홀을 방문했다."
author,"작가; 저자","Who is your favorite author?","당신이 가장 좋아하는 작가는 누구입니까?"
authority,"당국; 권위; 권한","The local authorities have decided to close the road.","지방 당국은 도로를 폐쇄하기로 결정했다."
autonomy,"자치권; 자주성","The new law gives the region greater autonomy.","새 법률은 그 지역에 더 큰 자치권을 부여한다."
available,"이용 가능한","Are there any tickets available for tonight's show?","오늘 밤 공연에 이용 가능한 표가 있나요?"
average,"평균; 보통; 평균의","The average score on the test was 75%.","시험의 평균 점수는 75%였다."
aviator,"비행사; 조종사","Amelia Earhart was a pioneering aviator.","아멜리아 이어하트는 선구적인 비행사였다."
avoid,"피하다; 예방하다","Try to avoid making the same mistake again.","같은 실수를 다시 저지르지 않도록 노력하세요."
award,"상; 상금; 수여하다; 주다","She won an award for her outstanding contribution.","그녀는 뛰어난 공헌으로 상을 받았다."
awesome,"경탄할 만한; 엄청난; 훌륭한","The view from the top of the mountain was awesome.","산 정상에서 본 경치는 정말 멋졌다."
bachelor,"학사; 미혼 남성","He has a bachelor's degree in computer science.","그는 컴퓨터 공학 학사 학위를 가지고 있다."
ballot,"무기명 투표; 무기명 투표를 실시하다","The election will be decided by a secret ballot.","선거는 무기명 투표로 결정될 것이다."
ban,"금지; 금지하다","The city has imposed a ban on plastic bags.","그 도시는 비닐봉지 사용을 금지했다."
barely,"간신히; 겨우","I could barely hear what she was saying.","나는 그녀가 무슨 말을 하는지 간신히 들을 수 있었다."
basis,"기초; 근거; 원리","His argument has no basis in fact.","그의 주장에는 사실에 근거가 없다."
bay,"(바다) 만","The hotel has a beautiful view of the bay.","그 호텔은 만의 아름다운 경치를 가지고 있다."
beach,"해변; 바닷가","Let's go for a walk along the beach.","해변을 따라 산책하러 가자."
bear,"낳다; 견디다","I cannot bear to see him so unhappy.","나는 그가 그렇게 불행한 것을 차마 볼 수 없다."
"bear the brunt of","~의 맹공을 정면에서 견디다","Coastal areas bore the brunt of the storm.","해안 지역이 폭풍의 맹공을 정면으로 받았다."
belong,"속하다; 소속하다","Does this book belong to you?","이 책은 당신의 것인가요?"
bend,"굽히다; 휘다","Can you bend your knees?","무릎을 굽힐 수 있나요?"
beverage,음료,"What kind of beverage would you like?","어떤 종류의 음료를 원하세요?"
bias,"편견; 치우침","The news report showed a clear bias towards the government.","그 뉴스 보도는 정부에 대한 명백한 편견을 보여주었다."
bike,"자전거; 오토바이;자전거(오토바이)를 타다","I like to bike to work when the weather is nice.","저는 날씨가 좋을 때 자전거를 타고 출근하는 것을 좋아합니다."
billiards,당구,"They spent the evening playing billiards.","그들은 당구를 치며 저녁을 보냈다."
biodiversity,생물 다양성,"The Amazon rainforest is known for its rich biodiversity.","아마존 열대우림은 풍부한 생물 다양성으로 유명하다."
biofuel,바이오 연료,"Scientists are developing new types of biofuel.","과학자들은 새로운 종류의 바이오 연료를 개발하고 있다."
bitterly,"몹시; 심하게","She complained bitterly about the cold weather.","그녀는 추운 날씨에 대해 몹시 불평했다."
bizarre,"기괴한; 별난","He told me a bizarre story about seeing a ghost.","그는 나에게 유령을 본 기괴한 이야기를 해주었다."
block,"덩어리; 블록;차단하다; 방해하다","A fallen tree is blocking the road.","쓰러진 나무가 길을 막고 있다."
"blonde (=blond)","금발 머리;금발 머리인","She has long blonde hair.","그녀는 긴 금발 머리를 가지고 있다."
blow,"한 줄기 바람; 코 풀기;바람에 날리다; 불다; 폭파하다","The wind is blowing hard today.","오늘은 바람이 세게 분다."
"blown away",크게 감동받은,"I was blown away by her amazing performance.","나는 그녀의 놀라운 공연에 크게 감동받았다."
"boarding school",기숙학교,"He was sent to a boarding school when he was young.","그는 어렸을 때 기숙학교에 보내졌다."
boost,"증대; 격려;돋우다; 밀어올리다; 증가하다","The good news gave a boost to the team's morale.","그 좋은 소식은 팀의 사기를 북돋워 주었다."
bother,"귀찮게 하다; 신경쓰다","I'm sorry to bother you, but could you help me?","귀찮게 해드려 죄송하지만, 좀 도와주시겠어요?"
boundary,경계(선),"The river forms the boundary between the two countries.","그 강은 두 나라 사이의 경계를 이룬다."
bountiful,"풍부한; 너그러운","We enjoyed a bountiful harvest this year.","우리는 올해 풍성한 수확을 즐겼다."
brace,"버팀대; 보호대;대비를 하다; 떠받치다","You should brace yourself for some bad news.","안 좋은 소식에 대비해야 합니다."
bracket,"선반; 괄호; 계층;선반을 달다; 괄호로 묶다","The items in the highest price bracket are very expensive.","가장 높은 가격대의 품목들은 매우 비싸다."
braid,"땋은 머리;(머리; 줄을) 땋다; 꼬다","She knows how to braid her own hair.","그녀는 스스로 머리를 땋을 줄 안다."
branch,"나뭇가지; 지사; 분과;갈라지다; 나뉘다","Our bank has branches all over the country.","우리 은행은 전국에 지점을 두고 있습니다."
breeze,"산들바람; 미풍","A gentle breeze was blowing through the trees.","부드러운 산들바람이 나무 사이로 불고 있었다."
brewing,"양조; 양조주","The art of brewing beer takes time and patience.","맥주 양조 기술은 시간과 인내가 필요하다."
bribery,뇌물 수수,"The official was arrested for bribery.","그 공무원은 뇌물 수수 혐의로 체포되었다."
brick,벽돌,"The house was built with red bricks.","그 집은 붉은 벽돌로 지어졌다."
brief,"개요; 짧은 기사;간단히 알리다; 요약하다;잠시의; 간결한","The meeting will be brief.","회의는 짧게 진행될 것입니다."
bright,"밝은; 빛나는","The sun is very bright today.","오늘은 해가 매우 밝다."
brilliant,"훌륭한; 눈부신; 멋진","She came up with a brilliant idea.","그녀는 아주 훌륭한 아이디어를 내놓았다."
broad,폭넓은,"He has a broad knowledge of history.","그는 역사에 대한 폭넓은 지식을 가지고 있다."
brutal,"잔인한; 야만적인; 냉엄한","The dictator was known for his brutal treatment of prisoners.","그 독재자는 포로에 대한 잔인한 처우로 알려져 있었다."
budget,예산,"We need to set a budget for our vacation.","우리는 휴가 예산을 세워야 한다."
bun,"둥근 빵; 쪽진 둥근 머리","She wore her hair in a tight bun.","그녀는 머리를 단단한 쪽머리로 묶었다."
burning,"연소;불타는; 중대한","It is a burning question that needs to be answered.","그것은 답변이 필요한 중대한 질문이다."
business,"일; 기업; 사업;직업상의","He runs a successful small business.","그는 성공적인 소규모 사업체를 운영한다."
"by ~ing",~함으로써,"You can learn a new language by studying a little every day.","매일 조금씩 공부함으로써 새로운 언어를 배울 수 있다."
cabinet,"장식장; 캐비닛; 내각;내각의; 기밀의; 장식장의","The documents are stored in a locked cabinet.","그 서류들은 잠긴 캐비닛에 보관되어 있다."
calamity,"재앙; 재난","The flood was a great calamity for the village.","그 홍수는 마을에 큰 재앙이었다."
calculate,"계산하다; 추산하다","I need to calculate my monthly expenses.","나는 월별 지출을 계산해야 한다."
camel,낙타,"A camel can travel for days without water.","낙타는 물 없이 며칠을 여행할 수 있다."
campaign,"캠페인; 유세 (선거 운동);캠페인을 벌이다","The company launched a new advertising campaign.","그 회사는 새로운 광고 캠페인을 시작했다."
capacity,"수용력(량); 용량; 성능;최대한의; 꽉 찬","The hall has a seating capacity of 500.","그 홀의 좌석 수용 능력은 500명이다."
capital,"수도; 대문자; 자본;대문자의","What is the capital of Australia?","호주의 수도는 어디인가요?"
capricious,"변덕스러운; 잘 변하는","The weather here is very capricious.","이곳의 날씨는 매우 변덕스럽다."
capture,"포획; 점령;붙잡다; 점령하다; 사로잡다","The police managed to capture the thief.","경찰은 도둑을 붙잡는 데 성공했다."
career,"직업; 직장생활","She is focusing on her career as a doctor.","그녀는 의사로서의 직업에 집중하고 있다."
cargo,"화물; 짐","The ship was loaded with cargo for a long voyage.","그 배는 긴 항해를 위한 화물을 싣고 있었다."
carrot,당근,"Rabbits love to eat carrots.","토끼는 당근 먹는 것을 좋아한다."
carry,"운반;나르다; 지니다; 도달하다","Can you help me carry this heavy box?","이 무거운 상자 옮기는 것 좀 도와줄래요?"
cautiously,조심스럽게,"She cautiously walked across the slippery floor.","그녀는 미끄러운 바닥을 조심스럽게 가로질러 걸었다."
ceaseless,끊임없는,"The ceaseless rain lasted for three days.","끊임없는 비가 3일 동안 계속되었다."
celebrate,"기념하다; 축하하다","We are going to celebrate his birthday tonight.","우리는 오늘 밤 그의 생일을 축하할 것이다."
certain,"몇 개; 몇 사람;특정한; 확실한; 어떤","I am certain that I left my keys on the table.","나는 열쇠를 탁자 위에 두고 온 것이 확실하다."
chairman,"의장; 사회자; 책임자;의(회)장직을 맡다; 사회하다","He was elected chairman of the board.","그는 이사회 의장으로 선출되었다."
challenging,"도전적인; 힘든","Learning a new language can be a challenging task.","새로운 언어를 배우는 것은 힘든 일이 될 수 있다."
chaos,"혼돈; 무질서","After the concert, the station was in complete chaos.","콘서트가 끝난 후, 역은 완전한 혼돈 상태였다."
chaotic,"혼돈된; 무질서한","The city's traffic is chaotic during peak hours.","그 도시의 교통은 출퇴근 시간에 혼잡하다."
charm,"매력; 마법; 장식;매혹하다; 매력이 있다; 마법을 걸다","The small village has a lot of charm.","그 작은 마을은 많은 매력을 가지고 있다."
chat,"담소; 수다; 채팅;이야기를 나누다; 수다를 떨다; 채팅하다","I had a nice chat with my neighbor this morning.","나는 오늘 아침 이웃과 즐거운 담소를 나누었다."
cheery,"기분 좋은; 명랑한","She has a very cheery personality.","그녀는 매우 명랑한 성격을 가지고 있다."
chemical,"화학 제품;화학의","This cleaner contains some strong chemicals.","이 세제에는 몇 가지 강한 화학 제품이 들어 있다."
chew,"씹기;씹다; 심사숙고하다","Remember to chew your food slowly.","음식을 천천히 씹는 것을 기억하세요."
childbirth,"출산; 분만","She had a difficult childbirth.","그녀는 힘든 출산을 했다."
chilly,"쌀쌀한; 냉담한","It's getting chilly, so you should wear a jacket.","쌀쌀해지고 있으니, 재킷을 입는 것이 좋겠어."
chore,"가사; 잡일","Washing the dishes is my least favorite chore.","설거지는 내가 가장 싫어하는 집안일이다."
choreography,"안무; 연출","The choreography for the musical was created by a famous dancer.","그 뮤지컬의 안무는 유명한 댄서에 의해 만들어졌다."
cigarette,"담배; 궐련","He decided to quit smoking cigarettes for his health.","그는 건강을 위해 담배를 끊기로 결심했다."
circuit,"순회; 회로;순회하다","An electrician is coming to check the electrical circuit.","전기 기사가 전기 회로를 점검하러 올 것이다."
citizenship,"시민권","After living there for ten years, she finally obtained citizenship.","그곳에서 10년을 산 후에, 그녀는 마침내 시민권을 취득했다."
claw,"(동물의) 발톱; 집게발","The cat left a scratch on the sofa with its claw.","고양이가 발톱으로 소파에 흠집을 남겼다."
clear,"분명한; 맑은;제거하다; 맑아 지다","The instructions were clear and easy to follow.;Can you clear the table for me?","설명은 분명하고 따르기 쉬웠다.;식탁 좀 치워줄 수 있니?"
