word,meaning,sentence,sentence_translation
dissolve,"녹다; 용해시키다; 해산하다","Salt dissolves in water.","소금은 물에 녹는다."
distinction,"구별; 차이; 특징; 우수성","There is a clear distinction between the two concepts.","두 개념 사이에는 명확한 구별이 있다."
distinguished,"저명한; 뛰어난","He is a distinguished professor of history.","그는 저명한 역사학 교수이다."
district,"지구; 지역; 선거구","The city is divided into several administrative districts.","그 도시는 여러 행정 구역으로 나뉘어 있다."
diversity,다양성,"The city is known for its cultural diversity.","그 도시는 문화적 다양성으로 유명하다."
divert,"방향을 바꾸게 하다; (생각·관심을) 다른 데로 돌리다","The police diverted traffic away from the accident scene.","경찰은 사고 현장에서 교통을 우회시켰다."
doorstep,"현관; 문앞;호별 방문하다","The package was left on my doorstep.","소포가 현관문 앞에 놓여 있었다."
dot,"점;점을 찍다; 여기저기 흩어져 있다","Please sign on the dotted line.","점선 위에 서명해 주세요."
doubtful,"의심스러운; 확신이 없는","I am doubtful about our chances of winning.","나는 우리가 이길 가능성에 대해 회의적이다."
downstream,"하류 부분; 하류의;하류에; 강 아래로","The town is located about five miles downstream from here.","그 마을은 여기서 하류로 약 5마일 떨어진 곳에 위치해 있다."
"drag oneself","발을 질질 끌며 걷다; 억지로 가다","After the long hike, he could barely drag himself home.","긴 하이킹 후에, 그는 간신히 몸을 이끌고 집으로 갔다."
dramatic,"극적인; 연극의","There was a dramatic increase in sales last month.","지난달 매출이 극적으로 증가했다."
drawing,그림,"She won first prize for her beautiful drawing.","그녀는 아름다운 그림으로 1등 상을 받았다."
drizzle,"보슬비; 이슬비;비가 보슬보슬 내리다","It started to drizzle just as we were leaving.","우리가 막 떠나려 할 때 보슬비가 내리기 시작했다."
drop,"(액체의) 방울;떨어지다","A single drop of rain fell on her nose.","빗방울 하나가 그녀의 코에 떨어졌다."
droplet,"작은 물방울","Tiny droplets of water covered the leaves.","아주 작은 물방울들이 나뭇잎을 덮고 있었다."
drought,가뭄,"The long drought has caused serious problems for farmers.","오랜 가뭄은 농부들에게 심각한 문제를 야기했다."
drug,"약; 마약; 의약품;약을 타다; 약을 먹이다","The doctor prescribed a new drug for his condition.","의사는 그의 상태에 맞는 새로운 약을 처방했다."
easygoing,"느긋한; 태평스러운","He has an easygoing personality and rarely gets stressed.","그는 느긋한 성격을 가지고 있어서 좀처럼 스트레스를 받지 않는다."
eclipse,"(일식/월식의) 식","We watched the total solar eclipse with special glasses.","우리는 특수 안경을 쓰고 개기 일식을 관찰했다."
economic,"경제의; 경제적인","The country is facing several economic challenges.","그 나라는 여러 경제적 어려움에 직면해 있다."
economist,경제학자,"An economist predicts that the market will improve next year.","한 경제학자는 내년에 시장이 개선될 것이라고 예측한다."
elect,"선출하다; 선택하다;선발된; 선출된","The people will elect a new president next month.","국민들은 다음 달에 새로운 대통령을 선출할 것이다."
electrician,전기 기사,"We called an electrician to fix the broken light.","우리는 고장 난 전등을 고치기 위해 전기 기사를 불렀다."
electron,전자,"An atom consists of a nucleus and one or more electrons.","원자는 원자핵과 하나 이상의 전자로 구성된다."
elementary,"초보적인; 기본적인; 초등학교의","He is taking an elementary course in Spanish.","그는 스페인어 초급 과정을 수강하고 있다."
eliminate,"제거하다; 없애다; 탈락시키다","The new policy aims to eliminate unnecessary paperwork.","새로운 정책은 불필요한 서류 작업을 없애는 것을 목표로 한다."
elliptical,"타원형의; 생략의","The planets move in elliptical orbits around the sun.","행성들은 태양 주위를 타원 궤도로 움직인다."
eloquent,"웅변을 잘 하는; 유창한","She gave an eloquent speech that moved the entire audience.","그녀는 청중 모두를 감동시킨 유창한 연설을 했다."
embarrass,"어리둥절하게 하다; 방해하다; 당황하다","His constant questions started to embarrass the speaker.","그의 끊임없는 질문은 연사를 당황하게 하기 시작했다."
embrace,"포옹; 받아들임;포옹하다; 기꺼이 받아들이다","They embraced each other warmly at the airport.;She decided to embrace the new opportunity.","그들은 공항에서 서로를 따뜻하게 포옹했다.;그녀는 새로운 기회를 기꺼이 받아들이기로 결정했다."
emotion,"감동; 감정","He spoke with great emotion about his childhood.","그는 자신의 어린 시절에 대해 큰 감정을 담아 이야기했다."
emphasize,강조하다,"The teacher emphasized the importance of studying regularly.","선생님은 규칙적으로 공부하는 것의 중요성을 강조했다."
employee,직원,"The company has over 500 employees.","그 회사는 500명 이상의 직원을 두고 있다."
empower,권한을 주다,"The program is designed to empower young women in business.","그 프로그램은 비즈니스계의 젊은 여성들에게 힘을 실어주기 위해 고안되었다."
empty,"비우다; 없어지다;비어 있는; 공허한","The bottle is empty.;Please empty the trash can.","병이 비어있다.;쓰레기통을 비워주세요."
enable,"~을 할 수 있게 하다","This new technology will enable us to work more efficiently.","이 새로운 기술은 우리가 더 효율적으로 일할 수 있게 해줄 것이다."
encounter,"만남; 접촉; 시합;맞닥뜨리다; 우연히 만나다","I had a brief encounter with an old friend at the supermarket.","나는 슈퍼마켓에서 옛 친구와 잠시 마주쳤다."
encouraging,"격려의; 고무적인","The teacher's encouraging words motivated the students.","선생님의 격려의 말은 학생들에게 동기를 부여했다."
endorse,"지지하다; 광고하다","Many celebrities endorse this brand of cosmetics.","많은 유명인들이 이 화장품 브랜드를 홍보한다."
"engage in","~에 종사하다; 관여하다; 참여하다","You should not engage in illegal activities.","불법적인 활동에 관여해서는 안 됩니다."
enhance,"높이다; 향상시키다","Using good lighting can enhance the quality of your photos.","좋은 조명을 사용하면 사진의 질을 높일 수 있다."
enlarge,"확대하다; 확장하다","We need to enlarge the photo to see the details.","세부 사항을 보려면 사진을 확대해야 한다."
enlighten,"이해시키다; 깨우치다","Could you enlighten me on this complex topic?","이 복잡한 주제에 대해 저를 이해시켜 주실 수 있나요?"
enrich,"부유하게 하다; 풍부하게 하다","Traveling can greatly enrich your life.","여행은 당신의 삶을 크게 풍요롭게 할 수 있다."
enrollment,"등록; 입학; 입대","Enrollment for the new course begins next week.","새로운 강좌의 등록은 다음 주에 시작됩니다."
ensure,"보장하다; 안전하게 하다","Please ensure that all the doors are locked before you leave.","떠나기 전에 모든 문이 잠겨 있는지 확인해 주세요."
entertainer,연예인,"He is a talented entertainer who can sing, dance, and act.","그는 노래, 춤, 연기를 할 수 있는 재능 있는 연예인이다."
enthusiastic,"열렬한; 열광적인","The crowd gave an enthusiastic welcome to the team.","관중들은 그 팀을 열광적으로 환영했다."
entire,"전체의; 온","He ate the entire pizza by himself.","그는 피자 한 판을 혼자 다 먹었다."
entry,"입장; 입국; 가입; 입구","The entry fee to the museum is ten dollars.","박물관 입장료는 10달러입니다."
eradicate,"뿌리째 뽑다; 근절하다","The goal is to eradicate poverty in the region.","목표는 그 지역의 빈곤을 근절하는 것이다."
error,"실수; 오류","There seems to be an error in the calculation.","계산에 오류가 있는 것 같습니다."
erstwhile,"이전의; 옛날의","He met with his erstwhile opponent to discuss a new partnership.","그는 새로운 파트너십을 논의하기 위해 옛 경쟁자를 만났다."
especially,"특히; 주로","I love all kinds of fruit, especially strawberries.","나는 모든 종류의 과일을 좋아하는데, 특히 딸기를 좋아한다."
ethical,"윤리적인; 도덕적인","Doctors must adhere to a strict ethical code.","의사들은 엄격한 윤리 강령을 준수해야 한다."
evaluate,"평가하다; 값을 산정하다","We need to evaluate the effectiveness of the new marketing campaign.","우리는 새로운 마케팅 캠페인의 효과를 평가해야 한다."
even,"평평한; 균등한; 짝수의;심지어 ~도; 훨씬 더","He can't even ride a bicycle.;This movie is even better than the first one.","그는 자전거조차 탈 수 없다.;이 영화는 첫 번째 것보다 훨씬 더 좋다."
eventually,"결국; 마침내","After many attempts, he eventually succeeded.","많은 시도 끝에, 그는 마침내 성공했다."
military,"군대;군사의; 무력의","He has a long and distinguished military career.","그는 길고 뛰어난 군 경력을 가지고 있다."
mimic,"흉내 내다","The comedian is famous for mimicking celebrities.","그 코미디언은 유명인들을 흉내 내는 것으로 유명하다."
mingle,"섞(이)다; 어울리다","She loves to mingle with different people at parties.","그녀는 파티에서 다양한 사람들과 어울리는 것을 좋아한다."
miniature,"축소 모형; 세밀화;소형의; 축소된","He collects miniature cars.","그는 소형 자동차 모형을 수집한다."
mishap,"작은 사고; 불상사","The party went well, apart from a small mishap with the cake.","케이크에 작은 사고가 있었던 것 외에는 파티가 순조롭게 진행되었다."
misunderstanding,"오해하다;진가를 못 알아보다","Their argument was based on a simple misunderstanding.","그들의 말다툼은 단순한 오해에서 비롯되었다."
modeling,"모형 제작; 모델링","She is pursuing a career in modeling.","그녀는 모델링 분야에서 경력을 쌓고 있다."
moderately,"중간 정도로; 적정하게","The movie was moderately successful at the box office.","그 영화는 흥행에서 중간 정도의 성공을 거두었다."
modulation,"조절; 조정","The modulation of his voice showed he was getting angry.","그의 목소리 조절은 그가 화가 나고 있음을 보여주었다."
molecule,분자,"A water molecule is made up of two hydrogen atoms and one oxygen atom.","물 분자는 두 개의 수소 원자와 한 개의 산소 원자로 이루어져 있다."
monetary,"통화의; 금전상의","The government announced new monetary policies to control inflation.","정부는 인플레이션을 통제하기 위한 새로운 통화 정책을 발표했다."
monopoly,"독점; 전유물","The company has a monopoly on the local telecommunications market.","그 회사는 지역 통신 시장을 독점하고 있다."
morale,"사기; 의욕","Winning the game boosted the team's morale.","경기에서 이긴 것은 팀의 사기를 높였다."
mortality,"죽음을 면할 수 없는 운명; 인간; 사망(률)","The infant mortality rate has decreased significantly.","유아 사망률이 크게 감소했다."
mosquito,모기,"A mosquito bite can be very itchy.","모기에 물리면 매우 가려울 수 있다."
motion,"운동; 움직임; 동작;신호하다","He made a motion with his hand for me to come closer.","그는 나에게 더 가까이 오라고 손짓했다."
motivate,"동기를 부여하다; 자극하다","His passion for music motivated him to practice every day.","음악에 대한 그의 열정은 그가 매일 연습하도록 동기를 부여했다."
movement,"운동; 동작; 행동","The dance is characterized by its slow, graceful movements.","그 춤은 느리고 우아한 동작이 특징이다."
mud,"진흙;진흙투성이로 만들다","The children were playing happily in the mud.","아이들은 진흙 속에서 즐겁게 놀고 있었다."
municipal,"지방 자치의; 시의","The city is responsible for municipal services like garbage collection.","그 도시는 쓰레기 수거와 같은 시 행정 서비스를 책임지고 있다."
municipality,"지방 자치 단체(시; 읍 등)","The municipality has a new plan for urban development.","그 지방 자치 단체는 도시 개발을 위한 새로운 계획을 가지고 있다."
mustache,콧수염,"He decided to grow a mustache.","그는 콧수염을 기르기로 결심했다."
mutation,"돌연변이","A genetic mutation can cause certain diseases.","유전적 돌연변이는 특정 질병을 유발할 수 있다."
mutual,"상호의","The agreement was based on mutual trust and respect.","그 합의는 상호 신뢰와 존중을 바탕으로 했다."
mystery,"신비(한 것); 미스터리","The cause of the ancient ruins remains a mystery.","고대 유적의 원인은 여전히 미스터리로 남아 있다."
mythical,"신화 속에 나오는; 사실이 아닌","Unicorns and dragons are mythical creatures.","유니콘과 용은 신화 속의 동물이다."
nausea,"메스꺼움; 혐오; 구역질","The boat's movement caused her to feel nausea.","배의 움직임은 그녀에게 메스꺼움을 유발했다."
nearsighted,"근시의; 근시안적인","He needs to wear glasses because he is nearsighted.","그는 근시라서 안경을 껴야 한다."
negligible,"무시해도 좋은; 하찮은","The difference in price between the two products is negligible.","두 제품의 가격 차이는 무시해도 될 정도이다."
negotiate,"협상하다; 성사시키다","The two countries will meet to negotiate a peace treaty.","두 나라는 평화 조약을 협상하기 위해 만날 것이다."
neighbor,"이웃 사람;이웃하다; 인접하다;이웃의","My neighbor is always friendly and helpful.","내 이웃은 항상 친절하고 도움을 준다."
neighborhood,"근처; 이웃 사람들; 주인; 지역","This is a safe and quiet neighborhood to live in.","이곳은 살기에 안전하고 조용한 동네이다."
neurological,"신경의; 신경학의","The patient is suffering from a neurological disorder.","그 환자는 신경계 질환을 앓고 있다."
nonetheless,"그럼에도 불구하고; 그렇더라도","The task was difficult, but she completed it nonetheless.","그 일은 어려웠지만, 그럼에도 불구하고 그녀는 그것을 완수했다."
normal,"표준; 평균; 정상;표준의; 보통의","His temperature is back to normal.","그의 체온은 정상으로 돌아왔다."
notorious,"악명 높은","The criminal was notorious for his daring robberies.","그 범죄자는 대담한 강도 행위로 악명이 높았다."
nuisance,"성가심; 골칫거리; 방해","The loud construction noise has been a real nuisance.","시끄러운 공사 소음은 정말 골칫거리였다."
numerous,"수많은; 다수의","Numerous studies have shown the benefits of exercise.","수많은 연구들이 운동의 이점을 보여주었다."
obesity,비만,"Obesity is a major health problem in many countries.","비만은 많은 나라에서 주요한 건강 문제이다."
obligation,"의무; 책임; 약정","Parents have a legal obligation to care for their children.","부모는 자녀를 돌볼 법적 의무가 있다."
observant,"준수자; 엄수자;관찰력 있는; 엄수하는","An observant witness provided a detailed description of the suspect.","관찰력 있는 목격자가 용의자의 상세한 인상착의를 제공했다."
observer,"관찰자; 관측자","From his perspective as an observer, the situation seemed calm.","관찰자로서 그의 관점에서 상황은 평온해 보였다."
obsession,"강박 관념; 망상","He has an obsession with collecting rare stamps.","그는 희귀한 우표를 수집하는 데 집착한다."
obvious,"명백한; 뻔한","It was obvious that she was not happy with the decision.","그녀가 그 결정에 만족하지 못하는 것은 명백했다."
occasionally,"때때로; 가끔","We occasionally go out for dinner on weekends.","우리는 주말에 가끔 외식을 한다."
occupy,"차지하다; 점령하다","The company will occupy the top two floors of the building.","그 회사는 건물의 위쪽 두 층을 차지할 것이다."
occur,"일어나다; 발생하다","A serious accident occurred on the highway this morning.","오늘 아침 고속도로에서 심각한 사고가 발생했다."
offspring,"자식; 새끼","The bird is busy feeding its offspring.","그 새는 새끼에게 먹이를 주느라 바쁘다."
"on and off","이따금; 오락가락","It rained on and off all day.","하루 종일 비가 오락가락했다."
once,"한 번; 한때;~하자마자","I have only visited that city once.","나는 그 도시에 한 번만 가봤다."
online,"온라인의;온라인으로","I do most of my shopping online.","나는 대부분의 쇼핑을 온라인으로 한다."
onset,시작,"The onset of winter brings colder weather.","겨울의 시작은 더 추운 날씨를 가져온다."
optimism,"낙관론; 낙관주의","Despite the challenges, she is filled with optimism for the future.","어려움에도 불구하고, 그녀는 미래에 대한 낙관으로 가득 차 있다."
option,"선택(권); 옵션","You have the option to pay in cash or by credit card.","현금 또는 신용카드로 결제할 수 있는 선택권이 있습니다."
orbital,"궤도의","The space station is in a stable orbital path around Earth.","우주 정거장은 지구 주위의 안정적인 궤도에 있다."
ordered,"정돈된; 질서정연한","Her desk was always neat and ordered.","그녀의 책상은 항상 깔끔하고 정돈되어 있었다."
orientation,"방향; 지향; 오리엔테이션","The company provides a two-day orientation for new employees.","그 회사는 신입 사원들을 위해 이틀간의 오리엔테이션을 제공한다."
"out of","~의 안에서 밖으로; ~의 범위 밖에","He took a book out of his bag.","그는 가방에서 책을 꺼냈다."
outbreak,"발생; 발발","There has been an outbreak of flu in the city.","도시에서 독감이 발생했다."
outcome,"결과; 성과","The outcome of the election will be announced tonight.","선거 결과는 오늘 밤 발표될 것이다."
outset,"착수; 시초","From the outset, it was clear that the project would be successful.","처음부터 그 프로젝트가 성공할 것이라는 것은 분명했다."
outspoken,"거침없이 말하는; 노골적인","She is known for her outspoken criticism of the government.","그녀는 정부에 대한 거침없는 비판으로 알려져 있다."
outweigh,"~보다 더 크다; 대단하다","The benefits of the new plan outweigh the costs.","새로운 계획의 이점이 비용보다 크다."
overcast,"구름으로 덮다; 흐리게 하다;구름이 뒤덮인; 흐린","The sky was overcast and it looked like it was going to rain.","하늘은 구름이 잔뜩 끼어 있었고 비가 올 것 같았다."
overflow,"넘쳐흐름; 과잉;범람하다; 가득 차다; 넘쳐흐르다","The river is about to overflow its banks.","강이 둑을 넘으려 하고 있다."
ownership,"소유; 소유권","The ownership of the company has changed hands several times.","그 회사의 소유권은 여러 번 바뀌었다."
parade,"퍼레이드; 행진;열지어 행진하다","Thousands of people watched the colorful parade.","수천 명의 사람들이 화려한 퍼레이드를 지켜보았다."
parallel,"평행하는 것; 일치하는 것;유사하다; 평행하다;병행의; 서로 같은","The road runs parallel to the river.","그 도로는 강과 평행하게 나 있다."
paralyze,"마비시키다; 무력하게 만들다","Fear paralyzed him, and he couldn't move.","두려움이 그를 마비시켜, 그는 움직일 수 없었다."
paramount,"무엇보다 중요한; 최고의","The safety of our passengers is of paramount importance.","승객의 안전이 무엇보다 중요합니다."
participate,"참가하다; 참여하다","Everyone is encouraged to participate in the discussion.","모든 사람이 토론에 참여하도록 권장됩니다."
partly,"부분적으로; 어느 정도는","The accident was partly his fault.","그 사고는 부분적으로 그의 잘못이었다."
"part-time","파트타임의; 비상근의;파트타임으로; 비상근으로","She has a part-time job at a coffee shop.","그녀는 커피숍에서 파트타임으로 일한다."
pass,"지나가다; 통과시키다; 합격하다;한 구절; 통과; 통로;통과하다","You need to show your pass to enter the building.","건물에 들어가려면 출입증을 보여줘야 합니다."
passage,"한 구절; 통과; 통로;통과하다","He read a passage from his favorite book.","그는 자신이 가장 좋아하는 책의 한 구절을 읽었다."
passionate,"격정적인; 열정적인","She has a passionate interest in art history.","그녀는 미술사에 열정적인 관심을 가지고 있다."
patch,"조각; 작은 밭(땅);덧대다","He had a patch over one eye.","그는 한쪽 눈에 안대를 하고 있었다."
patiently,"끈기 있게; 점잖게","She waited patiently for the bus to arrive.","그녀는 버스가 도착하기를 끈기 있게 기다렸다."
pause,"멈춤; 중단;정지시키다; 잠시 멈추다","Let's take a short pause for a coffee break.","잠시 커피 타임을 갖도록 합시다."
paw,"발;앞발로 긁다; 서투르게 다루다","The cat gently touched my face with its paw.","고양이가 발로 내 얼굴을 부드럽게 만졌다."
pedestrian,보행자,"The new bridge is open to both vehicles and pedestrians.","새 다리는 차량과 보행자 모두에게 개방되어 있다."
peek,엿보다,"She peeked through the curtains to see who was there.","그녀는 누가 있는지 보려고 커튼 사이로 엿보았다."
peninsula,반도,"The Korean Peninsula is located in East Asia.","한반도는 동아시아에 위치해 있다."
perceptive,"지각의; 통찰력이 있는","He is a perceptive critic who always offers insightful analysis.","그는 항상 통찰력 있는 분석을 제공하는 예리한 비평가이다."
perform,공연하다,"The band will perform live at the festival.","그 밴드는 축제에서 라이브 공연을 할 것이다."
perpetually,"영속적으로; 끊임없이","He seems to be perpetually busy.","그는 끊임없이 바쁜 것 같다."
perseverance,"인내; 끈기","With perseverance, you can achieve your goals.","인내심을 가지면 목표를 달성할 수 있다."
persistence,"고집; 버팀","Her persistence finally paid off, and she got the job.","그녀의 끈기는 마침내 결실을 맺어, 그녀는 그 일자리를 얻었다."
personally,"개인적으로; 직접","I would like to speak to him personally.","나는 그와 개인적으로 이야기하고 싶다."
personnel,"직원; 인사과","The company's personnel department is responsible for hiring new employees.","회사의 인사과는 신입 사원 채용을 담당한다."
perspective,"원근법; 전망; 시각;원근법에 의한","From my perspective, the decision was a mistake.","내 관점에서 보면 그 결정은 실수였다."
persuasion,설득; 신념,"He has strong powers of persuasion.","그는 강한 설득력을 가지고 있다."
pharmacy,"약학; 약국","I need to go to the pharmacy to pick up my prescription.","나는 처방전을 받으러 약국에 가야 한다."
phase,"양상; 단계; 주기;단계적으로 실행하다","The project is now in its final phase.","그 프로젝트는 이제 마지막 단계에 있다."
physical,"신체의; 물질의; 물리적인","Regular physical activity is good for your health.","규칙적인 신체 활동은 건강에 좋다."
physiological,"생리학의; 생리적인","The experiment studied the physiological effects of stress.","그 실험은 스트레스의 생리적 효과를 연구했다."
pinpoint,"핀 끝; 정확한;정확히 찾아내다; 집어내다","It's difficult to pinpoint the exact cause of the problem.","문제의 정확한 원인을 찾아내기는 어렵다."
pitch,"던지기; 음조(음의 높낮이);던지다; 조절하다","The pitcher threw a fast pitch.","투수는 빠른 공을 던졌다."
"place an order",주문하다,"I would like to place an order for a large pizza.","저는 라지 피자를 주문하고 싶습니다."
planet,행성,"Earth is the third planet from the Sun.","지구는 태양에서 세 번째 행성이다."
platform,"대; 연단; 승강장","Please wait for the train on platform 3.","3번 승강장에서 기차를 기다려 주세요."
plausible,그럴듯한,"He gave a plausible explanation for his absence.","그는 자신의 결석에 대해 그럴듯한 설명을 했다."
"play a key role",중요한 역할을 하다,"Education plays a key role in a child's development.","교육은 아이의 발달에 중요한 역할을 한다."
plot,"음모; 줄거리;줄거리를 꾸미다","The plot of the movie was full of twists and turns.","그 영화의 줄거리는 반전으로 가득했다."
podium,"연단; 지휘대","She walked confidently to the podium to give her speech.","그녀는 연설을 하기 위해 자신감 있게 연단으로 걸어갔다."
